"Bronx Tale, A (1993)","Clockwork Orange, A (1971)",Chairman of the Board (1998),"Body Snatcher, The (1945)","Funeral, The (1996)",Commandments (1997),"Princess Bride, The (1987)","Truth About Cats & Dogs, The (1996)",Chairman of the Board (1998),Cop Land (1997)
Forrest Gump (1994),Lost in Space (1998),"Madness of King George, The (1994)",My Crazy Life (Mi vida loca) (1993),National Lampoon's Senior Trip (1995),Phantoms (1998),Spawn (1997),"Secret Adventures of Tom Thumb, The (1993)",Safe Passage (1994),Wes Craven's New Nightmare (1994)
Back to the Future (1985),Somebody to Love (1994),On Golden Pond (1981),"Portrait of a Lady, The (1996)","Godfather: Part II, The (1974)",Mary Shelley's Frankenstein (1994),Sliding Doors (1998),Forrest Gump (1994),G.I. Jane (1997),"Umbrellas of Cherbourg, The (Parapluies de Cherbourg, Les) (1964)"
"First Wives Club, The (1996)","Rock, The (1996)",Liar Liar (1997),"Perez Family, The (1995)",101 Dalmatians (1996),Mute Witness (1994),Ponette (1996),"Truth or Consequences, N.M. (1997)",Marked for Death (1990),"Trigger Effect, The (1996)"
In & Out (1997),Good Will Hunting (1997),Jackie Brown (1997),Daniel Defoe's Robinson Crusoe (1996),"Peacemaker, The (1997)",Titanic (1997),Mercury Rising (1998),High Noon (1952),Miami Rhapsody (1995),Cliffhanger (1993)
Mary Poppins (1964),"Lion King, The (1994)",Multiplicity (1996),Groundhog Day (1993),"Abyss, The (1989)","Apostle, The (1997)",Hercules (1997),Rough Magic (1995),Top Hat (1935),Full Metal Jacket (1987)
"Fugitive, The (1993)",Jaws (1975),Apollo 13 (1995),Ransom (1996),Stand by Me (1986),Victor/Victoria (1982),Spellbound (1945),"Eye of Vichy, The (Oeil de Vichy, L') (1993)",Heavy (1995),"Adventures of Pinocchio, The (1996)"
"English Patient, The (1996)",Jerry Maguire (1996),L.A. Confidential (1997),"Cure, The (1995)",Sphere (1998),Bad Taste (1987),Safe Passage (1994),I'll Do Anything (1994),Some Mother's Son (1996),Blade Runner (1982)
In the Company of Men (1997),"Full Monty, The (1997)",Flesh and Bone (1993),Striptease (1996),Getting Away With Murder (1996),Unforgiven (1992),Jean de Florette (1986),Target (1995),Blue in the Face (1995),Drop Dead Fred (1991)
Firestorm (1998),Carlito's Way (1993),Demolition Man (1993),Paris Was a Woman (1995),For Richer or Poorer (1997),Maya Lin: A Strong Clear Vision (1994),"Ciao, Professore! (1993)",Wes Craven's New Nightmare (1994),Mad Dog Time (1996),Caught (1996)
Seven Years in Tibet (1997),Unforgiven (1992),Hercules (1997),Titanic (1997),"Indian in the Cupboard, The (1995)",8 Seconds (1994),Rear Window (1954),Men With Guns (1997),Angela (1995),Captives (1994)
Return of the Jedi (1983),Double Team (1997),Stalingrad (1993),"Believers, The (1987)","Shining, The (1980)",Renaissance Man (1994),Ace Ventura: When Nature Calls (1995),King of the Hill (1993),Night Flier (1997),"Getaway, The (1994)"
Like Water For Chocolate (Como agua para chocolate) (1992),Above the Rim (1994),Roman Holiday (1953),Ulee's Gold (1997),Pulp Fiction (1994),Etz Hadomim Tafus (Under the Domin Tree) (1994),Jerry Maguire (1996),"Babysitter, The (1995)",My Fair Lady (1964),Safe Passage (1994)
Safe Passage (1994),"African Queen, The (1951)",Forrest Gump (1994),"Affair to Remember, An (1957)",Gigi (1958),Wes Craven's New Nightmare (1994),It's My Party (1995),Meet Wally Sparks (1997),Big Night (1996),Gang Related (1997)
Heaven's Prisoners (1996),"Wedding Singer, The (1998)",Just Cause (1995),"Ice Storm, The (1997)",Carlito's Way (1993),Ready to Wear (Pret-A-Porter) (1994),"Island of Dr. Moreau, The (1996)",Deceiver (1997),"Smile Like Yours, A (1997)",Down Periscope (1996)
Hamlet (1996),Marked for Death (1990),Faces (1968),To Live (Huozhe) (1994),Gigi (1958),Farewell My Concubine (1993),Bullets Over Broadway (1994),Night on Earth (1991),First Knight (1995),Grateful Dead (1995)
Pulp Fiction (1994),Monty Python's Life of Brian (1979),Street Fighter (1994),Boys on the Side (1995),Telling Lies in America (1997),Eat Drink Man Woman (1994),My Fair Lady (1964),JLG/JLG - autoportrait de décembre (1994),Bogus (1996),Carried Away (1996)
Calendar Girl (1993),Monty Python's Life of Brian (1979),Sliding Doors (1998),To Live (Huozhe) (1994),Heidi Fleiss: Hollywood Madam (1995) ,Spawn (1997),"Air Up There, The (1994)",Losing Isaiah (1995),Men in Black (1997),Á köldum klaka (Cold Fever) (1994)
"Sweet Hereafter, The (1997)",Alphaville (1965),Shadows (Cienie) (1988),Swimming with Sharks (1995),Mary Shelley's Frankenstein (1994),Desperado (1995),Reality Bites (1994),Amityville II: The Possession (1982),"Pyromaniac's Love Story, A (1995)","Apartment, The (1960)"
Fargo (1996),Batman (1989),"Remains of the Day, The (1993)",Daens (1992),Bulletproof (1996),Harlem (1993),Fausto (1993),Sirens (1994),Unzipped (1995),Crash (1996)
Infinity (1996),It Happened One Night (1934),"Saint, The (1997)","Adventures of Priscilla, Queen of the Desert, The (1994)",Michael (1996),"Collectionneuse, La (1967)",Father of the Bride (1950),"Steal Big, Steal Little (1995)",Ayn Rand: A Sense of Life (1997),Bad Moon (1996)
Terminator 2: Judgment Day (1991),Full Metal Jacket (1987),Apollo 13 (1995),Swimming with Sharks (1995),Safe Passage (1994),Miller's Crossing (1990),Fly Away Home (1996),Anne Frank Remembered (1995),Arsenic and Old Lace (1944),"Jungle Book, The (1994)"
Toy Story (1995),Absolute Power (1997),"Bewegte Mann, Der (1994)",Gridlock'd (1997),To Live (Huozhe) (1994),Blues Brothers 2000 (1998),Arsenic and Old Lace (1944),Canadian Bacon (1994),Fresh (1994),Sprung (1997)
Star Wars (1977),"Great Race, The (1965)",Species (1995),Field of Dreams (1989),All Things Fair (1996),"Relic, The (1997)",I'll Do Anything (1994),Being Human (1993),It Happened One Night (1934),"Ref, The (1994)"
Kolya (1996),"Mrs. Brown (Her Majesty, Mrs. Brown) (1997)","Ghost and the Darkness, The (1996)",Death and the Maiden (1994),"Crying Game, The (1992)",No Escape (1994),"Sixth Man, The (1997)",Getting Away With Murder (1996),She's So Lovely (1997),Primal Fear (1996)
Little Women (1994),Sneakers (1992),"Terminator, The (1984)",Bastard Out of Carolina (1996),Farewell My Concubine (1993),"Sword in the Stone, The (1963)",Shall We Dance? (1996),"Time to Kill, A (1996)",April Fool's Day (1986),"Awfully Big Adventure, An (1995)"
Forget Paris (1995),Star Wars (1977),So I Married an Axe Murderer (1993),King of the Hill (1993),Robert A. Heinlein's The Puppet Masters (1994),"Neon Bible, The (1995)","Maltese Falcon, The (1941)",Falling in Love Again (1980),Mr. Wonderful (1993),Clear and Present Danger (1994)
Star Trek: First Contact (1996),Fly Away Home (1996),I'll Do Anything (1994),"Return of Martin Guerre, The (Retour de Martin Guerre, Le) (1982)",Demolition Man (1993),"Smile Like Yours, A (1997)",Bogus (1996),Some Mother's Son (1996),Casino (1995),Restoration (1995)
First Kid (1996),Turbulence (1997),Glory (1989),"Usual Suspects, The (1995)","Lion King, The (1994)",Nikita (La Femme Nikita) (1990),"Brady Bunch Movie, The (1995)",Backbeat (1993),Hedd Wyn (1992),"Truth About Cats & Dogs, The (1996)"
Ulee's Gold (1997),"Killing Fields, The (1984)",I Don't Want to Talk About It (De eso no se habla) (1993),Sleepers (1996),Tales from the Crypt Presents: Bordello of Blood (1996),Year of the Horse (1997),"Apostle, The (1997)",Washington Square (1997),Stand by Me (1986),"Little Princess, The (1939)"
Dead Man (1995),Interview with the Vampire (1994),"Paris, Texas (1984)","Woman in Question, The (1950)",Miracle on 34th Street (1994),Brother Minister: The Assassination of Malcolm X (1994),Waiting for Guffman (1996),Star Trek: The Wrath of Khan (1982),Apollo 13 (1995),Purple Noon (1960)
Babe (1995),Once Upon a Time in America (1984),SubUrbia (1997),Mary Reilly (1996),Amityville II: The Possession (1982),Heathers (1989),Batman Forever (1995),Arsenic and Old Lace (1944),Citizen Ruth (1996),Miller's Crossing (1990)
Rebecca (1940),"Ciao, Professore! (1993)",What Happened Was... (1994),"African Queen, The (1951)",Carlito's Way (1993),"Devil's Advocate, The (1997)",Harlem (1993),"Streetcar Named Desire, A (1951)",Stargate (1994),"Apartment, The (1960)"
Angela (1995),Being There (1979),Two if by Sea (1996),Free Willy 3: The Rescue (1997),Fargo (1996),Mrs. Dalloway (1997),For Love or Money (1993),Gone with the Wind (1939),"Hour of the Pig, The (1993)","Hunchback of Notre Dame, The (1996)"
Wes Craven's New Nightmare (1994),Telling Lies in America (1997),Deceiver (1997),"Cure, The (1995)",Pink Floyd - The Wall (1982),"Man of No Importance, A (1994)",Mother Night (1996),"Great White Hype, The (1996)","Adventures of Robin Hood, The (1938)",1-900 (1994)
Secrets & Lies (1996),Shanghai Triad (Yao a yao yao dao waipo qiao) (1995),Twin Town (1997),Welcome to the Dollhouse (1995),Better Off Dead... (1985),Frankie Starlight (1995),Window to Paris (1994),"Englishman Who Went Up a Hill, But Came Down a Mountain, The (1995)",Dante's Peak (1997),Carrington (1995)
It Takes Two (1995),Two Deaths (1995),Bogus (1996),It's My Party (1995),Wes Craven's New Nightmare (1994),Psycho (1960),Tin Cup (1996),Forrest Gump (1994),Telling Lies in America (1997),Casino (1995)
"Godfather: Part II, The (1974)",Blade Runner (1982),Arsenic and Old Lace (1944),"Philadelphia Story, The (1940)",Canadian Bacon (1994),Salut cousin! (1996),Before the Rain (Pred dozhdot) (1994),Swimming with Sharks (1995),"Newton Boys, The (1998)",Ran (1985)
Two if by Sea (1996),Marvin's Room (1996),Beautiful Girls (1996),Stuart Saves His Family (1995),"First Wives Club, The (1996)",Jimmy Hollywood (1994),Die Hard 2 (1990),Three Lives and Only One Death (1996),"Shadow, The (1994)",Rear Window (1954)
Alien (1979),Under Siege (1992),To Live (Huozhe) (1994),"Sixth Man, The (1997)",GoodFellas (1990),"Bewegte Mann, Der (1994)","Collectionneuse, La (1967)",Robin Hood: Prince of Thieves (1991),Spanking the Monkey (1994),"Getaway, The (1994)"
Glory (1989),Lone Star (1996),"Secret of Roan Inish, The (1994)",Flubber (1997),Secrets & Lies (1996),"Bye Bye, Love (1995)","Adventures of Priscilla, Queen of the Desert, The (1994)","Rainmaker, The (1997)",Celtic Pride (1996),"Wedding Singer, The (1998)"
Batman (1989),T-Men (1947),"Shooter, The (1995)","Wedding Singer, The (1998)",Kids in the Hall: Brain Candy (1996),"Devil's Advocate, The (1997)",Daniel Defoe's Robinson Crusoe (1996),"Old Man and the Sea, The (1958)",Stag (1997),"English Patient, The (1996)"
Like Water For Chocolate (Como agua para chocolate) (1992),Evil Dead II (1987),Winnie the Pooh and the Blustery Day (1968),Speed (1994),Mission: Impossible (1996),Hercules (1997),She's So Lovely (1997),Crash (1996),Butch Cassidy and the Sundance Kid (1969),Coneheads (1993)
"Three Musketeers, The (1993)",Wes Craven's New Nightmare (1994),Star Trek: The Wrath of Khan (1982),High Noon (1952),Bogus (1996),Roommates (1995),Boys on the Side (1995),Jaws 2 (1978),"Secret of Roan Inish, The (1994)",Ayn Rand: A Sense of Life (1997)
"Fifth Element, The (1997)",Back to the Future (1985),True Lies (1994),Unhook the Stars (1996),Sunset Blvd. (1950),Twisted (1996),Picture Bride (1995),"Inkwell, The (1994)",Taxi Driver (1976),"Maybe, Maybe Not (Bewegte Mann, Der) (1994)"
"First Wives Club, The (1996)",She's So Lovely (1997),Mary Poppins (1964),Delicatessen (1991),"Young Poisoner's Handbook, The (1995)","Princess Bride, The (1987)",Above the Rim (1994),Escape to Witch Mountain (1975),Nelly & Monsieur Arnaud (1995),Star Wars (1977)
Cosi (1996),"Apartment, The (1960)","Adventures of Robin Hood, The (1938)",Deceiver (1997),Sliding Doors (1998),Red Rock West (1992),"Perez Family, The (1995)",Grumpier Old Men (1995),"Sweet Hereafter, The (1997)",Relative Fear (1994)
Bad Taste (1987),Safe Passage (1994),Phantoms (1998),Spawn (1997),"Great Day in Harlem, A (1994)",Fools Rush In (1997),Star Wars (1977),"Abyss, The (1989)",Passion Fish (1992),Wag the Dog (1997)
Life with Mikey (1993),Wes Craven's New Nightmare (1994),"Smile Like Yours, A (1997)",Ed Wood (1994),Paris Was a Woman (1995),Psycho (1960),Gang Related (1997),1-900 (1994),Hard Rain (1998),Shall We Dance? (1937)
Celestial Clockwork (1994),"Hunt for Red October, The (1990)","Apostle, The (1997)","Paris, Texas (1984)",Striking Distance (1993),Sliding Doors (1998),Bushwhacked (1995),Bitter Sugar (Azucar Amargo) (1996),"Favor, The (1994)",Grace of My Heart (1996)
"Devil's Advocate, The (1997)",Dante's Peak (1997),Jerry Maguire (1996),What's Eating Gilbert Grape (1993),Twisted (1996),Nine Months (1995),Cinema Paradiso (1988),Air Force One (1997),Wings of Desire (1987),"Invitation, The (Zaproszenie) (1986)"
Toy Story (1995),Twelve Monkeys (1995),"Truth About Cats & Dogs, The (1996)",Unforgettable (1996),"Professional, The (1994)","Bewegte Mann, Der (1994)",Lawnmower Man 2: Beyond Cyberspace (1996),From Dusk Till Dawn (1996),Star Wars (1977),"Very Brady Sequel, A (1996)"
One Flew Over the Cuckoo's Nest (1975),Return of the Jedi (1983),"Client, The (1994)",Multiplicity (1996),"Hunt for Red October, The (1990)",Tin Cup (1996),"Jungle Book, The (1994)","Tin Drum, The (Blechtrommel, Die) (1979)",High Noon (1952),Renaissance Man (1994)
"Close Shave, A (1995)",Leaving Las Vegas (1995),Ill Gotten Gains (1997),Angels and Insects (1995),Marlene Dietrich: Shadow and Light (1996) ,GoldenEye (1995),Frankie Starlight (1995),High Noon (1952),Heaven's Prisoners (1996),Dingo (1992)
"English Patient, The (1996)",Liar Liar (1997),Mouse Hunt (1997),Cinema Paradiso (1988),Pulp Fiction (1994),Breakdown (1997),"Magnificent Seven, The (1954)",Paths of Glory (1957),Harlem (1993),Turbulence (1997)
True Romance (1993),"Trigger Effect, The (1996)",Twisted (1996),Faces (1968),White Squall (1996),Canadian Bacon (1994),Curdled (1996),Venice/Venice (1992),All About Eve (1950),Operation Dumbo Drop (1995)
"Princess Bride, The (1987)",Marvin's Room (1996),"Truth About Cats & Dogs, The (1996)","Last Time I Saw Paris, The (1954)",Squeeze (1996),Love Jones (1997),Tetsuo II: Body Hammer (1992),Home Alone 3 (1997),Backbeat (1993),"Rock, The (1996)"
"Shawshank Redemption, The (1994)","Great Escape, The (1963)",Some Mother's Son (1996),"Walk in the Clouds, A (1995)","Story of Xinghua, The (1993)",Arsenic and Old Lace (1944),"Next Karate Kid, The (1994)","Grass Harp, The (1995)",Death and the Maiden (1994),Hurricane Streets (1998)
"Truth About Cats & Dogs, The (1996)",Striptease (1996),Cyrano de Bergerac (1990),Victor/Victoria (1982),Home Alone 3 (1997),Crumb (1994),In the Line of Fire (1993),Lord of Illusions (1995),"Thin Man, The (1934)",Days of Thunder (1990)
JLG/JLG - autoportrait de décembre (1994),Antonia's Line (1995),My Crazy Life (Mi vida loca) (1993),Cobb (1994),Ill Gotten Gains (1997),Primary Colors (1998),Jupiter's Wife (1994),Heavyweights (1994),U.S. Marshalls (1998),Con Air (1997)
Everyone Says I Love You (1996),Scream (1996),Boogie Nights (1997),Three Lives and Only One Death (1996),"Promesse, La (1996)","Inkwell, The (1994)",Local Hero (1983),Field of Dreams (1989),Dr. Strangelove or: How I Learned to Stop Worrying and Love the Bomb (1963),I Know What You Did Last Summer (1997)
Mother Night (1996),Disclosure (1994),Oscar & Lucinda (1997),"Sweet Hereafter, The (1997)",Down Periscope (1996),Bent (1997),"Hunt for Red October, The (1990)",Ready to Wear (Pret-A-Porter) (1994),Jaws 3-D (1983),Jerry Maguire (1996)
Star Trek: First Contact (1996),Twelve Monkeys (1995),Before the Rain (Pred dozhdot) (1994),"Perez Family, The (1995)",Nobody Loves Me (Keiner liebt mich) (1994),My Man Godfrey (1936),"Air Up There, The (1994)",Excess Baggage (1997),Wonderland (1997),"Piano, The (1993)"
Cape Fear (1991),Coneheads (1993),My Favorite Year (1982),French Twist (Gazon maudit) (1995),"Adventures of Pinocchio, The (1996)",Bent (1997),Groundhog Day (1993),Ace Ventura: Pet Detective (1994),For Richer or Poorer (1997),"Ciao, Professore! (1993)"
Lover's Knot (1996),Hurricane Streets (1998),For Richer or Poorer (1997),S.F.W. (1994),Land and Freedom (Tierra y libertad) (1995),Bent (1997),Relative Fear (1994),Love and a .45 (1994),Young Guns II (1990),"Murder, My Sweet (1944)"
Andre (1994),Fargo (1996),Fair Game (1995),Mortal Kombat: Annihilation (1997),Kaspar Hauser (1993),"White Balloon, The (1995)",Fantasia (1940),No Escape (1994),Diva (1981),"Very Brady Sequel, A (1996)"
Beautiful Thing (1996),North by Northwest (1959),August (1996),"Wizard of Oz, The (1939)",Hercules (1997),Victor/Victoria (1982),Denise Calls Up (1995),Cyrano de Bergerac (1990),Cat on a Hot Tin Roof (1958),All Over Me (1997)
Dead Poets Society (1989),Bent (1997),Tom & Viv (1994),Mediterraneo (1991),Ready to Wear (Pret-A-Porter) (1994),Red Rock West (1992),Carlito's Way (1993),Flubber (1997),In the Mouth of Madness (1995),Alice in Wonderland (1951)
Mrs. Dalloway (1997),Everyone Says I Love You (1996),Washington Square (1997),Mr. Magoo (1997),Albino Alligator (1996),"Kiss Me, Guido (1997)",Rosencrantz and Guildenstern Are Dead (1990),"Flintstones, The (1994)",Night Flier (1997),American Dream (1990)
"Apostle, The (1997)",Breakdown (1997),"Man Who Would Be King, The (1975)","Adventures of Robin Hood, The (1938)",Swimming with Sharks (1995),Apt Pupil (1998),Dangerous Minds (1995),Hostile Intentions (1994),Kiss the Girls (1997),"Philadelphia Story, The (1940)"
Gigi (1958),"Nightmare on Elm Street, A (1984)",Speechless (1994),In & Out (1997),Touch (1997),"Flintstones, The (1994)","Madness of King George, The (1994)",Amityville II: The Possession (1982),Mary Shelley's Frankenstein (1994),"Smile Like Yours, A (1997)"
My Life as a Dog (Mitt liv som hund) (1985),Much Ado About Nothing (1993),Star Wars (1977),Wings of Desire (1987),Turbulence (1997),First Knight (1995),Alien: Resurrection (1997),Best Men (1997),I'm Not Rappaport (1996),So Dear to My Heart (1949)
Fargo (1996),Deep Rising (1998),"Blues Brothers, The (1980)","Hunchback of Notre Dame, The (1996)",Tin Men (1987),Stealing Beauty (1996),"Grass Harp, The (1995)",Orlando (1993),"Apostle, The (1997)",Daniel Defoe's Robinson Crusoe (1996)
Star Wars (1977),Return of the Jedi (1983),Field of Dreams (1989),"Rendezvous in Paris (Rendez-vous de Paris, Les) (1995)","Bewegte Mann, Der (1994)",Love Jones (1997),Michael (1996),April Fool's Day (1986),Fresh (1994),Forrest Gump (1994)
Jupiter's Wife (1994),Raise the Red Lantern (1991),Carrie (1976),As Good As It Gets (1997),Extreme Measures (1996),Jerry Maguire (1996),Hurricane Streets (1998),Dangerous Minds (1995),"Endless Summer 2, The (1994)",Ayn Rand: A Sense of Life (1997)
Titanic (1997),Power 98 (1995),"Promise, The (Versprechen, Das) (1994)",Jeffrey (1995),"Big Green, The (1995)",Hear My Song (1991),"Very Brady Sequel, A (1996)",Delicatessen (1991),Unzipped (1995),Kansas City (1996)
Men in Black (1997),"Rock, The (1996)",Solo (1996),E.T. the Extra-Terrestrial (1982),Naked (1993),Children of the Revolution (1996),Donnie Brasco (1997),Twisted (1996),"Old Man and the Sea, The (1958)",Flirt (1995)
It Happened One Night (1934),M*A*S*H (1970),Patton (1970),Striptease (1996),"Arrival, The (1996)",Princess Caraboo (1994),"Leopard Son, The (1996)",I'm Not Rappaport (1996),"Ghost and Mrs. Muir, The (1947)",Denise Calls Up (1995)
Face/Off (1997),Rent-a-Kid (1995),"Bewegte Mann, Der (1994)",Dead Poets Society (1989),Frankie Starlight (1995),Reality Bites (1994),Virtuosity (1995),I'm Not Rappaport (1996),Daylight (1996),Sunset Park (1996)
Star Wars (1977),"Edge, The (1997)",Toy Story (1995),Getting Away With Murder (1996),Target (1995),Better Off Dead... (1985),"Godfather: Part II, The (1974)",Sleepers (1996),187 (1997),Raiders of the Lost Ark (1981)
Margaret's Museum (1995),Being There (1979),Get Shorty (1995),Hercules (1997),"Killing Fields, The (1984)","Big Green, The (1995)",Safe Passage (1994),Star Maps (1997),Somebody to Love (1994),"Truth About Cats & Dogs, The (1996)"
Toy Story (1995),Courage Under Fire (1996),G.I. Jane (1997),Executive Decision (1996),First Knight (1995),"Cable Guy, The (1996)","Little Princess, A (1995)",Lashou shentan (1992),Body Snatchers (1993),Mrs. Doubtfire (1993)
Braveheart (1995),"Shawshank Redemption, The (1994)","Terminator, The (1984)","Grass Harp, The (1995)",American Dream (1990),Intimate Relations (1996),Jerry Maguire (1996),Unhook the Stars (1996),House Arrest (1996),He Walked by Night (1948)
Cold Comfort Farm (1995),Star Wars (1977),Amityville 1992: It's About Time (1992),Bonnie and Clyde (1967),"Shining, The (1980)",Home Alone 3 (1997),Switchback (1997),I'll Do Anything (1994),Johns (1996),"Magnificent Seven, The (1954)"
"Full Monty, The (1997)","Steal Big, Steal Little (1995)",Faster Pussycat! Kill! Kill! (1965),M*A*S*H (1970),Aliens (1986),Audrey Rose (1977),King of the Hill (1993),Canadian Bacon (1994),Fresh (1994),Hoop Dreams (1994)
Forrest Gump (1994),Meet Wally Sparks (1997),Demolition Man (1993),"Sweet Hereafter, The (1997)",Sliding Doors (1998),Angels and Insects (1995),"Air Up There, The (1994)",Body Parts (1991),Wes Craven's New Nightmare (1994),Spawn (1997)
Commandments (1997),Made in America (1993),Moonlight and Valentino (1995),Dr. Strangelove or: How I Learned to Stop Worrying and Love the Bomb (1963),Annie Hall (1977),French Kiss (1995),Ben-Hur (1959),"Van, The (1996)",Days of Thunder (1990),Fall (1997)
Return of the Jedi (1983),Delicatessen (1991),"Big Green, The (1995)",Independence Day (ID4) (1996),King of the Hill (1993),Turbulence (1997),Days of Thunder (1990),"Eye of Vichy, The (Oeil de Vichy, L') (1993)",Raiders of the Lost Ark (1981),White Man's Burden (1995)
Groundhog Day (1993),Kingpin (1996),Return of the Jedi (1983),When Harry Met Sally... (1989),"Hunchback of Notre Dame, The (1996)",Sprung (1997),Field of Dreams (1989),Michael (1996),Walking and Talking (1996),"Flower of My Secret, The (Flor de mi secreto, La) (1995)"
Pushing Hands (1992),"Life Less Ordinary, A (1997)",Body Parts (1991),Paris Was a Woman (1995),Forrest Gump (1994),"Adventures of Robin Hood, The (1938)",Stargate (1994),Wes Craven's New Nightmare (1994),"Sound of Music, The (1965)",For Richer or Poorer (1997)
Forrest Gump (1994),Donnie Brasco (1997),Tin Cup (1996),Roommates (1995),"Search for One-eye Jimmy, The (1996)",Safe Passage (1994),Nick of Time (1995),Legends of the Fall (1994),Ponette (1996),Alphaville (1965)
Air Force One (1997),Father of the Bride Part II (1995),Intimate Relations (1996),"Truth About Cats & Dogs, The (1996)",Suture (1993),Twisted (1996),"Jackal, The (1997)","Fox and the Hound, The (1981)","Game, The (1997)",Primal Fear (1996)
Fried Green Tomatoes (1991),Sling Blade (1996),Bananas (1971),Hercules (1997),"Birds, The (1963)","Old Lady Who Walked in the Sea, The (Vieille qui marchait dans la mer, La) (1991)",Super Mario Bros. (1993),Shooting Fish (1997),Nobody's Fool (1994),Muppet Treasure Island (1996)
Four Days in September (1997),"Three Musketeers, The (1993)",Reality Bites (1994),She's So Lovely (1997),"Jungle Book, The (1994)",Incognito (1997),Venice/Venice (1992),"Last of the Mohicans, The (1992)",Toy Story (1995),"Clockwork Orange, A (1971)"
"Peacemaker, The (1997)",In the Name of the Father (1993),Hercules (1997),Mary Shelley's Frankenstein (1994),Forget Paris (1995),"Tie That Binds, The (1995)",Glory (1989),House Arrest (1996),Batman (1989),Hana-bi (1997)
Willy Wonka and the Chocolate Factory (1971),Twister (1996),Raiders of the Lost Ark (1981),"Room with a View, A (1986)",Babe (1995),Pulp Fiction (1994),Mighty Aphrodite (1995),Bad Moon (1996),Ill Gotten Gains (1997),"Crow, The (1994)"
Contact (1997),Raiders of the Lost Ark (1981),"Wrong Trousers, The (1993)","Butcher Boy, The (1998)","Paper, The (1994)",Hard Target (1993),August (1996),Home Alone 3 (1997),"Big Green, The (1995)",First Kid (1996)
Hercules (1997),Star Trek: The Motion Picture (1979),Love and a .45 (1994),"Show, The (1995)","Bye Bye, Love (1995)",Little Buddha (1993),Tales From the Crypt Presents: Demon Knight (1995),Foreign Correspondent (1940),Death and the Maiden (1994),Assassins (1995)
Fargo (1996),Air Force One (1997),Contact (1997),Independence Day (ID4) (1996),"Return of Martin Guerre, The (Retour de Martin Guerre, Le) (1982)",Return of the Jedi (1983),Mr. Holland's Opus (1995),Kama Sutra: A Tale of Love (1996),Mars Attacks! (1996),Cinderella (1950)
Don't Be a Menace to South Central While Drinking Your Juice in the Hood (1996),Crash (1996),"Celluloid Closet, The (1995)",Daens (1992),Wings of Desire (1987),"Love Bug, The (1969)",Deep Rising (1998),Malice (1993),Daylight (1996),Little City (1998)
Monty Python and the Holy Grail (1974),How to Be a Player (1997),Pie in the Sky (1995),Love Affair (1994),Billy Madison (1995),"Niagara, Niagara (1997)",Phenomenon (1996),"Boot, Das (1981)","White Balloon, The (1995)",Dear God (1996)
Fargo (1996),Nothing Personal (1995),My Man Godfrey (1936),"Walk in the Clouds, A (1995)",An Unforgettable Summer (1994),Canadian Bacon (1994),Buddy (1997),As Good As It Gets (1997),Playing God (1997),Mrs. Winterbourne (1996)
"Wedding Singer, The (1998)",Hercules (1997),Nelly & Monsieur Arnaud (1995),She's So Lovely (1997),"Remains of the Day, The (1993)","Jackal, The (1997)",Air Force One (1997),Lightning Jack (1994),Persuasion (1995),Hamlet (1996)
Mystery Science Theater 3000: The Movie (1996),Face/Off (1997),Glory (1989),"Women, The (1939)","Body Snatcher, The (1945)",Year of the Horse (1997),"Peacemaker, The (1997)",In & Out (1997),Bastard Out of Carolina (1996),Spanking the Monkey (1994)
"Graduate, The (1967)",Mrs. Doubtfire (1993),Raging Bull (1980),One Flew Over the Cuckoo's Nest (1975),"Piano, The (1993)",GoodFellas (1990),Glengarry Glen Ross (1992),"Fifth Element, The (1997)",Margaret's Museum (1995),Amadeus (1984)
Seven Years in Tibet (1997),Picture Perfect (1997),Washington Square (1997),"English Patient, The (1996)",Faust (1994),"Usual Suspects, The (1995)",Foxfire (1996),Spice World (1997),"River Wild, The (1994)",Rebecca (1940)
