Lone Star (1996),Gandhi (1982),Last Summer in the Hamptons (1995),Terminator 2: Judgment Day (1991),This Is Spinal Tap (1984),Wallace & Gromit: The Best of Aardman Animation (1996),Mute Witness (1994),Sliding Doors (1998),Mother Night (1996),Killing Zoe (1994)
Men in Black (1997),Ben-Hur (1959),"Big Green, The (1995)",American Buffalo (1996),Everyone Says I Love You (1996),Body Snatchers (1993),"Godfather, The (1972)",No Escape (1994),Out to Sea (1997),Home Alone 3 (1997)
Gandhi (1982),"Graduate, The (1967)","Adventures of Priscilla, Queen of the Desert, The (1994)",Desert Winds (1995),Mr. Wonderful (1993),"Beans of Egypt, Maine, The (1994)",Speed (1994),"Air Up There, The (1994)",Marvin's Room (1996),"Horseman on the Roof, The (Hussard sur le toit, Le) (1995)"
Heat (1995),Shadows (Cienie) (1988),Jerry Maguire (1996),Muriel's Wedding (1994),While You Were Sleeping (1995),"Walking Dead, The (1995)",My Fair Lady (1964),"Empire Strikes Back, The (1980)",Assassins (1995),Get Shorty (1995)
Speed (1994),"Rock, The (1996)","Philadelphia Story, The (1940)",Frankie Starlight (1995),"Leopard Son, The (1996)","Return of Martin Guerre, The (Retour de Martin Guerre, Le) (1982)",Above the Rim (1994),"Modern Affair, A (1995)",Better Off Dead... (1985),"Truman Show, The (1998)"
Willy Wonka and the Chocolate Factory (1971),Alaska (1996),"Apostle, The (1997)","Favor, The (1994)","Clockwork Orange, A (1971)",Hostile Intentions (1994),"Secret Adventures of Tom Thumb, The (1993)","Apartment, The (1960)",Carlito's Way (1993),"Adventures of Pinocchio, The (1996)"
Forrest Gump (1994),Heaven's Prisoners (1996),Blink (1994),"Nightmare on Elm Street, A (1984)",Cosi (1996),"Professional, The (1994)",Hurricane Streets (1998),Dead Poets Society (1989),"Slingshot, The (1993)",Ready to Wear (Pret-A-Porter) (1994)
Braveheart (1995),Jurassic Park (1993),My Man Godfrey (1936),"Terminator, The (1984)",Dead Man Walking (1995),"Big Bang Theory, The (1994)",Sunset Blvd. (1950),"Amityville Curse, The (1990)",Aliens (1986),"Convent, The (Convento, O) (1995)"
This Is Spinal Tap (1984),Local Hero (1983),Faster Pussycat! Kill! Kill! (1965),Mad Love (1995),"Brothers McMullen, The (1995)",All Over Me (1997),It's My Party (1995),Vertigo (1958),Hana-bi (1997),Wyatt Earp (1994)
"Wizard of Oz, The (1939)","Clockwork Orange, A (1971)",Dangerous Beauty (1998),Wallace & Gromit: The Best of Aardman Animation (1996),"Very Brady Sequel, A (1996)",My Favorite Year (1982),Broken Arrow (1996),"Boot, Das (1981)","Magnificent Seven, The (1954)","MatchMaker, The (1997)"
Scream (1996),Cosi (1996),GoldenEye (1995),"English Patient, The (1996)","Apartment, The (1960)",Ulee's Gold (1997),James and the Giant Peach (1996),Mr. Jones (1993),Kama Sutra: A Tale of Love (1996),Somebody to Love (1994)
Hoop Dreams (1994),Swimming with Sharks (1995),That Darn Cat! (1997),"Trigger Effect, The (1996)",Gilligan's Island: The Movie (1998),Apollo 13 (1995),"Chamber, The (1996)","Babysitter, The (1995)",Beat the Devil (1954),Legal Deceit (1997)
Amistad (1997),Dangerous Minds (1995),Hostile Intentions (1994),Margaret's Museum (1995),"Crucible, The (1996)",Ayn Rand: A Sense of Life (1997),Daens (1992),"Empire Strikes Back, The (1980)",Traveller (1997),"Murder, My Sweet (1944)"
Mina Tannenbaum (1994),"Sword in the Stone, The (1963)","White Balloon, The (1995)",Showgirls (1995),Rosencrantz and Guildenstern Are Dead (1990),To Be or Not to Be (1942),Female Perversions (1996),Bulletproof (1996),Raiders of the Lost Ark (1981),Brother Minister: The Assassination of Malcolm X (1994)
Clerks (1994),Pretty Woman (1990),Amadeus (1984),Schindler's List (1993),Lightning Jack (1994),It's a Wonderful Life (1946),Ulee's Gold (1997),12 Angry Men (1957),"Firm, The (1993)",Forrest Gump (1994)
Hush (1998),"Maybe, Maybe Not (Bewegte Mann, Der) (1994)","African Queen, The (1951)",Heaven's Prisoners (1996),For Richer or Poorer (1997),To Kill a Mockingbird (1962),Sliding Doors (1998),Bloodsport 2 (1995),"House of the Spirits, The (1993)",Mother Night (1996)
Kolya (1996),My Life as a Dog (Mitt liv som hund) (1985),Circle of Friends (1995),"Smile Like Yours, A (1997)",Persuasion (1995),Swept from the Sea (1997),Ponette (1996),Lone Star (1996),Two Deaths (1995),Amityville II: The Possession (1982)
Breakdown (1997),Donnie Brasco (1997),Disclosure (1994),Star Wars (1977),Crows and Sparrows (1949),Babe (1995),My Man Godfrey (1936),Forrest Gump (1994),1-900 (1994),Three Colors: Blue (1993)
Titanic (1997),Hedd Wyn (1992),Stand by Me (1986),Daniel Defoe's Robinson Crusoe (1996),M*A*S*H (1970),Getting Away With Murder (1996),Apollo 13 (1995),To Kill a Mockingbird (1962),Ghost (1990),Gilligan's Island: The Movie (1998)
Fearless (1993),Pulp Fiction (1994),Now and Then (1995),Desert Winds (1995),Crash (1996),August (1996),Celtic Pride (1996),"Hate (Haine, La) (1995)",Hercules (1997),Courage Under Fire (1996)
Jaws 2 (1978),"Portrait of a Lady, The (1996)",Ed Wood (1994),"Maybe, Maybe Not (Bewegte Mann, Der) (1994)",Shooting Fish (1997),Mary Reilly (1996),Circle of Friends (1995),Death in Brunswick (1991),"Basketball Diaries, The (1995)","Thin Blue Line, The (1988)"
"Spitfire Grill, The (1996)",Independence Day (ID4) (1996),That Darn Cat! (1965),Losing Isaiah (1995),Tokyo Fist (1995),Babe (1995),"Red Firecracker, Green Firecracker (1994)",Boomerang (1992),"Women, The (1939)",Angus (1995)
"Madness of King George, The (1994)","Sweet Hereafter, The (1997)",Wyatt Earp (1994),Relative Fear (1994),Hush (1998),Singin' in the Rain (1952),All About Eve (1950),Mary Shelley's Frankenstein (1994),Ulee's Gold (1997),"Jungle Book, The (1994)"
Dolores Claiborne (1994),Meet John Doe (1941),Frankie Starlight (1995),Surviving the Game (1994),Terminator 2: Judgment Day (1991),Dead Man (1995),"Ice Storm, The (1997)",Salut cousin! (1996),Cosi (1996),Red Rock West (1992)
So Dear to My Heart (1949),"Godfather: Part II, The (1974)",Schindler's List (1993),Breaking the Waves (1996),"Silence of the Lambs, The (1991)",Kingpin (1996),Akira (1988),Flirt (1995),Little City (1998),Amityville 1992: It's About Time (1992)
Tom & Viv (1994),"Smile Like Yours, A (1997)",Stargate (1994),Surviving the Game (1994),Safe Passage (1994),"Adventures of Robin Hood, The (1938)","Great Day in Harlem, A (1994)",Lover's Knot (1996),Freeway (1996),Children of the Revolution (1996)
Priest (1994),Fresh (1994),Calendar Girl (1993),Small Faces (1995),Enchanted April (1991),Back to the Future (1985),Nell (1994),"Sweet Hereafter, The (1997)",My Life as a Dog (Mitt liv som hund) (1985),"Omen, The (1976)"
"Adventures of Robin Hood, The (1938)",SubUrbia (1997),Tom & Viv (1994),"Cure, The (1995)",Calendar Girl (1993),Bent (1997),"Boys of St. Vincent, The (1993)",Sabrina (1954),Michael (1996),Surviving the Game (1994)
Air Force One (1997),"Truth About Cats & Dogs, The (1996)",Soul Food (1997),Six Degrees of Separation (1993),Spanking the Monkey (1994),Love and Death on Long Island (1997),Man of the House (1995),Clockers (1995),Tales from the Hood (1995),Forget Paris (1995)
Gigi (1958),Bitter Sugar (Azucar Amargo) (1996),"African Queen, The (1951)","Secret of Roan Inish, The (1994)",Phantoms (1998),Ayn Rand: A Sense of Life (1997),"Scarlet Letter, The (1926)",Forrest Gump (1994),Georgia (1995),Shadow of Angels (Schatten der Engel) (1976)
"Apartment, The (1960)",Love and Death on Long Island (1997),Mary Shelley's Frankenstein (1994),In & Out (1997),Roommates (1995),"Tango Lesson, The (1997)",Mad Dog Time (1996),"Damsel in Distress, A (1937)",It Takes Two (1995),Sliding Doors (1998)
Soul Food (1997),Amistad (1997),"Devil's Advocate, The (1997)","Truth About Cats & Dogs, The (1996)","Englishman Who Went Up a Hill, But Came Down a Mountain, The (1995)",First Knight (1995),"Apostle, The (1997)",Titanic (1997),E.T. the Extra-Terrestrial (1982),Air Force One (1997)
Forrest Gump (1994),Spawn (1997),Mediterraneo (1991),Roommates (1995),It's My Party (1995),Down Periscope (1996),Henry V (1989),Gigi (1958),House Party 3 (1994),"Crying Game, The (1992)"
Fried Green Tomatoes (1991),Sling Blade (1996),Mighty Aphrodite (1995),Hamlet (1996),"Maltese Falcon, The (1941)","Hate (Haine, La) (1995)",Field of Dreams (1989),Kazaam (1996),Mystery Science Theater 3000: The Movie (1996),Above the Rim (1994)
"Frighteners, The (1996)",Stranger in the House (1997),Sleepers (1996),Geronimo: An American Legend (1993),William Shakespeare's Romeo and Juliet (1996),Kicked in the Head (1997),Man of the House (1995),Mortal Kombat (1995),Somewhere in Time (1980),Cliffhanger (1993)
Grumpier Old Men (1995),Star Wars (1977),"Peacemaker, The (1997)",August (1996),Carpool (1996),Nothing to Lose (1994),Daniel Defoe's Robinson Crusoe (1996),City of Industry (1997),"Davy Crockett, King of the Wild Frontier (1955)","Death in the Garden (Mort en ce jardin, La) (1956)"
Evil Dead II (1987),Bob Roberts (1992),"City of Lost Children, The (1995)","Women, The (1939)","Van, The (1996)",Mallrats (1995),Joe's Apartment (1996),"Gate of Heavenly Peace, The (1995)",Getting Away With Murder (1996),Grateful Dead (1995)
Star Wars (1977),3 Ninjas: High Noon At Mega Mountain (1998),"Truth About Cats & Dogs, The (1996)",Carlito's Way (1993),Safe Passage (1994),Death in Brunswick (1991),"Air Up There, The (1994)","Great Day in Harlem, A (1994)",Shadowlands (1993),"Favor, The (1994)"
Trainspotting (1996),"Rock, The (1996)","Secret of Roan Inish, The (1994)","Godfather, The (1972)","Road to Wellville, The (1994)",Vertigo (1958),I Don't Want to Talk About It (De eso no se habla) (1993),Fantasia (1940),White Squall (1996),Tom & Viv (1994)
Seven (Se7en) (1995),Forrest Gump (1994),"Last of the Mohicans, The (1992)",Real Genius (1985),"Island of Dr. Moreau, The (1996)",Tin Cup (1996),Being Human (1993),Calendar Girl (1993),"Pillow Book, The (1995)",Trial and Error (1997)
"Hunchback of Notre Dame, The (1996)",Daniel Defoe's Robinson Crusoe (1996),Audrey Rose (1977),Bean (1997),Pinocchio (1940),It Happened One Night (1934),"Neon Bible, The (1995)",Alphaville (1965),Love and Death on Long Island (1997),"Air Up There, The (1994)"
Romy and Michele's High School Reunion (1997),Die Hard (1988),Independence Day (ID4) (1996),Mystery Science Theater 3000: The Movie (1996),It Happened One Night (1934),Butch Cassidy and the Sundance Kid (1969),"Long Kiss Goodnight, The (1996)",Kids in the Hall: Brain Candy (1996),Picnic (1955),When a Man Loves a Woman (1994)
Sense and Sensibility (1995),"Walk in the Clouds, A (1995)",Ed Wood (1994),"Adventures of Robin Hood, The (1938)",Mrs. Winterbourne (1996),Antonia's Line (1995),Carrie (1976),Speechless (1994),Crimson Tide (1995),"Affair to Remember, An (1957)"
"Magnificent Seven, The (1954)",Wyatt Earp (1994),Short Cuts (1993),"Jungle Book, The (1994)",Life with Mikey (1993),Air Force One (1997),Sliver (1993),Dream With the Fishes (1997),Washington Square (1997),Ponette (1996)
Star Trek IV: The Voyage Home (1986),Rosencrantz and Guildenstern Are Dead (1990),Arsenic and Old Lace (1944),"Silence of the Lambs, The (1991)",Star Trek III: The Search for Spock (1984),Jaws 2 (1978),"Designated Mourner, The (1997)",Star Trek: The Motion Picture (1979),Loch Ness (1995),Of Love and Shadows (1994)
"Eye of Vichy, The (Oeil de Vichy, L') (1993)",Two if by Sea (1996),Gordy (1995),Contact (1997),"Relic, The (1997)",Night Flier (1997),Eye for an Eye (1996),Chairman of the Board (1998),Brassed Off (1996),Striking Distance (1993)
Roman Holiday (1953),French Kiss (1995),Farinelli: il castrato (1994),"Remains of the Day, The (1993)","Adventures of Robin Hood, The (1938)",Air Force One (1997),Kolya (1996),Surviving the Game (1994),"Endless Summer 2, The (1994)",M (1931)
Ma vie en rose (My Life in Pink) (1997),Jason's Lyric (1994),James and the Giant Peach (1996),Bad Moon (1996),Tie Me Up! Tie Me Down! (1990),"Walk in the Clouds, A (1995)",M (1931),Back to the Future (1985),Three Colors: Red (1994),Dangerous Minds (1995)
Picture Perfect (1997),Tomorrow Never Dies (1997),"Rainmaker, The (1997)",Arsenic and Old Lace (1944),Miller's Crossing (1990),Leaving Las Vegas (1995),Being Human (1993),Ponette (1996),Rear Window (1954),Small Faces (1995)
Amistad (1997),Somewhere in Time (1980),"Rock, The (1996)",Children of the Revolution (1996),Paradise Lost: The Child Murders at Robin Hood Hills (1996),Daylight (1996),Dazed and Confused (1993),Blue Chips (1994),My Man Godfrey (1936),North (1994)
Firestorm (1998),Fire on the Mountain (1996),I Know What You Did Last Summer (1997),Fire Down Below (1997),Anna Karenina (1997),G.I. Jane (1997),Lord of Illusions (1995),Othello (1995),It Takes Two (1995),Mallrats (1995)
"Adventures of Robin Hood, The (1938)",Jerry Maguire (1996),"Very Natural Thing, A (1974)",Freeway (1996),Relative Fear (1994),Mary Shelley's Frankenstein (1994),Primary Colors (1998),"Walk in the Clouds, A (1995)",Rent-a-Kid (1995),Roommates (1995)
"Shawshank Redemption, The (1994)",My Family (1995),"Walk in the Clouds, A (1995)",Forget Paris (1995),"Terminator, The (1984)",Kids in the Hall: Brain Candy (1996),Interview with the Vampire (1994),"Paris, France (1993)","Flower of My Secret, The (Flor de mi secreto, La) (1995)",Love and Death on Long Island (1997)
Aliens (1986),Mary Poppins (1964),Cosi (1996),Relative Fear (1994),Grease (1978),Bent (1997),Kolya (1996),Kiss of Death (1995),Ayn Rand: A Sense of Life (1997),Don Juan DeMarco (1995)
Higher Learning (1995),"Secret Adventures of Tom Thumb, The (1993)",Jerry Maguire (1996),"Nightmare on Elm Street, A (1984)","Favor, The (1994)",My Crazy Life (Mi vida loca) (1993),"War, The (1994)",Gigi (1958),Raise the Red Lantern (1991),Trainspotting (1996)
Ransom (1996),Home Alone 3 (1997),Courage Under Fire (1996),Exotica (1994),Dr. Strangelove or: How I Learned to Stop Worrying and Love the Bomb (1963),"Relic, The (1997)",Tales from the Crypt Presents: Bordello of Blood (1996),"Philadelphia Story, The (1940)",Lightning Jack (1994),Conspiracy Theory (1997)
"People vs. Larry Flynt, The (1996)",Chasing Amy (1997),Good Will Hunting (1997),Secrets & Lies (1996),Lone Star (1996),Half Baked (1998),Titanic (1997),King of the Hill (1993),"Innocents, The (1961)",Boy's Life 2 (1997)
Miller's Crossing (1990),Batman (1989),Arsenic and Old Lace (1944),Blood For Dracula (Andy Warhol's Dracula) (1974),Waiting for Guffman (1996),Walking and Talking (1996),Forbidden Planet (1956),Beavis and Butt-head Do America (1996),"Getaway, The (1994)",Blue Chips (1994)
Contact (1997),"Long Kiss Goodnight, The (1996)",Chungking Express (1994),"Big Blue, The (Grand bleu, Le) (1988)",Batman (1989),Dr. Strangelove or: How I Learned to Stop Worrying and Love the Bomb (1963),Evil Dead II (1987),"Big Green, The (1995)",Tetsuo II: Body Hammer (1992),"Baby-Sitters Club, The (1995)"
Chasing Amy (1997),Down by Law (1986),Bonnie and Clyde (1967),"Godfather, The (1972)","Ghost and Mrs. Muir, The (1947)",Rocket Man (1997),"Story of Xinghua, The (1993)",She's So Lovely (1997),Boys on the Side (1995),"Second Jungle Book: Mowgli & Baloo, The (1997)"
Dangerous Minds (1995),Two Much (1996),Midnight in the Garden of Good and Evil (1997),Henry V (1989),The Courtyard (1995),Just Cause (1995),Mary Reilly (1996),Reality Bites (1994),Ma vie en rose (My Life in Pink) (1997),"Air Up There, The (1994)"
"Godfather: Part II, The (1974)","Wizard of Oz, The (1939)",Nell (1994),"Philadelphia Story, The (1940)",Twilight (1998),Sunset Blvd. (1950),Once Upon a Time in America (1984),Stripes (1981),Warriors of Virtue (1997),"Scarlet Letter, The (1995)"
Small Faces (1995),"Cure, The (1995)","Babysitter, The (1995)",For Richer or Poorer (1997),Michael (1996),Last Summer in the Hamptons (1995),Rob Roy (1995),Operation Dumbo Drop (1995),Death in Brunswick (1991),Batman Returns (1992)
"Big Lebowski, The (1998)",Seven (Se7en) (1995),Back to the Future (1985),Baton Rouge (1988),Head Above Water (1996),Gigi (1958),Dead Presidents (1995),"Amityville Horror, The (1979)",Gaslight (1944),Bad Moon (1996)
"Jungle Book, The (1994)","Very Natural Thing, A (1974)",Meet John Doe (1941),Mediterraneo (1991),Exotica (1994),Meet Wally Sparks (1997),"Saint, The (1997)",Condition Red (1995),In the Mouth of Madness (1995),"African Queen, The (1951)"
"Hunt for Red October, The (1990)",Striptease (1996),Jade (1995),Daniel Defoe's Robinson Crusoe (1996),Crash (1996),"Line King: Al Hirschfeld, The (1996)",Rough Magic (1995),Vegas Vacation (1997),"Little Princess, A (1995)",Lone Star (1996)
Flesh and Bone (1993),Nikita (La Femme Nikita) (1990),"Doom Generation, The (1995)",So I Married an Axe Murderer (1993),Duck Soup (1933),"Old Lady Who Walked in the Sea, The (Vieille qui marchait dans la mer, La) (1991)","Low Life, The (1994)",Shooting Fish (1997),Brothers in Trouble (1995),"Wings of the Dove, The (1997)"
Heat (1995),My Fellow Americans (1996),Raise the Red Lantern (1991),Lost in Space (1998),Con Air (1997),Death in Brunswick (1991),Herbie Rides Again (1974),Surviving the Game (1994),Across the Sea of Time (1995),Dolores Claiborne (1994)
"Smile Like Yours, A (1997)","Very Natural Thing, A (1974)",Sliding Doors (1998),Shiloh (1997),"Man from Down Under, The (1943)",Calendar Girl (1993),Telling Lies in America (1997),Just Cause (1995),Circle of Friends (1995),Down Periscope (1996)
Monty Python's Life of Brian (1979),Legends of the Fall (1994),Turbulence (1997),Little Lord Fauntleroy (1936),"Crow, The (1994)","Room with a View, A (1986)","Low Down Dirty Shame, A (1994)",Naked (1993),"Philadelphia Story, The (1940)","Three Musketeers, The (1993)"
"Godfather, The (1972)","Crying Game, The (1992)",Raiders of the Lost Ark (1981),King of the Hill (1993),"Princess Bride, The (1987)",Days of Thunder (1990),Inventing the Abbotts (1997),"Celluloid Closet, The (1995)",April Fool's Day (1986),Michael Collins (1996)
Grace of My Heart (1996),Cyclo (1995),Mary Poppins (1964),Highlander III: The Sorcerer (1994),It Takes Two (1995),"Three Caballeros, The (1945)",Benny & Joon (1993),Alien (1979),Scream (1996),"Very Brady Sequel, A (1996)"
Contact (1997),Cop Land (1997),L.A. Confidential (1997),Liar Liar (1997),Jaws 3-D (1983),Crows and Sparrows (1949),Jack (1996),Angel on My Shoulder (1946),Barcelona (1994),Supercop (1992)
"Umbrellas of Cherbourg, The (Parapluies de Cherbourg, Les) (1964)",Forrest Gump (1994),Dead Man (1995),"African Queen, The (1951)",Shopping (1994),"Air Up There, The (1994)",Enchanted April (1991),Jerry Maguire (1996),"Juror, The (1996)","Great White Hype, The (1996)"
Fly Away Home (1996),Contact (1997),"Ice Storm, The (1997)",Mina Tannenbaum (1994),"Full Monty, The (1997)","Jerky Boys, The (1994)",Widows' Peak (1994),"Secret Adventures of Tom Thumb, The (1993)",Nelly & Monsieur Arnaud (1995),"Adventures of Pinocchio, The (1996)"
"Sweet Hereafter, The (1997)",House Party 3 (1994),Girl 6 (1996),"American President, The (1995)",Sliding Doors (1998),Down Periscope (1996),Desperate Measures (1998),"Apartment, The (1960)",Kundun (1997),"Umbrellas of Cherbourg, The (Parapluies de Cherbourg, Les) (1964)"
"Apostle, The (1997)",An Unforgettable Summer (1994),Telling Lies in America (1997),My Crazy Life (Mi vida loca) (1993),Tom & Viv (1994),Spirits of the Dead (Tre passi nel delirio) (1968),"Fish Called Wanda, A (1988)",Mrs. Dalloway (1997),Alien: Resurrection (1997),My Favorite Season (1993)
Boys in Venice (1996),Swept from the Sea (1997),"Walk in the Sun, A (1945)","African Queen, The (1951)",Losing Isaiah (1995),Faces (1968),"Cement Garden, The (1993)","Adventures of Robin Hood, The (1938)",Being Human (1993),"Red Firecracker, Green Firecracker (1994)"
Good Will Hunting (1997),Dead Poets Society (1989),"Shining, The (1980)",Congo (1995),Exotica (1994),Getting Away With Murder (1996),"Trigger Effect, The (1996)",Switchback (1997),Mondo (1996),"Godfather, The (1972)"
Con Air (1997),Platoon (1986),Twelve Monkeys (1995),My Own Private Idaho (1991),Home Alone 3 (1997),"River Wild, The (1994)",I'm Not Rappaport (1996),Field of Dreams (1989),Heat (1995),Blue Sky (1994)
Star Wars (1977),"Sound of Music, The (1965)",Chasing Amy (1997),Tin Cup (1996),"Cure, The (1995)",Safe Passage (1994),Dark City (1998),Disclosure (1994),Curdled (1996),Forrest Gump (1994)
GoodFellas (1990),Stargate (1994),On Golden Pond (1981),Desperate Measures (1998),"Aristocats, The (1970)",Sabrina (1995),"Lawnmower Man, The (1992)",Monty Python's Life of Brian (1979),Bad Girls (1994),Bent (1997)
Carlito's Way (1993),"Apartment, The (1960)","Mirror Has Two Faces, The (1996)",Michael (1996),Wes Craven's New Nightmare (1994),Sliding Doors (1998),Faces (1968),Tom & Viv (1994),"Cure, The (1995)",Jimmy Hollywood (1994)
2001: A Space Odyssey (1968),"Fifth Element, The (1997)","Big Green, The (1995)",Down Periscope (1996),Fly Away Home (1996),Cliffhanger (1993),Fargo (1996),"Lay of the Land, The (1997)","Killing Fields, The (1984)",Tough and Deadly (1995)
"Godfather, The (1972)",Starship Troopers (1997),Mystery Science Theater 3000: The Movie (1996),"People vs. Larry Flynt, The (1996)",Kundun (1997),2001: A Space Odyssey (1968),Golden Earrings (1947),Soul Food (1997),Gold Diggers: The Secret of Bear Mountain (1995),Grosse Pointe Blank (1997)
"Hungarian Fairy Tale, A (1987)",Top Hat (1935),Killing Zoe (1994),Jerry Maguire (1996),"House of the Spirits, The (1993)",Relative Fear (1994),"Adventures of Robin Hood, The (1938)",Canadian Bacon (1994),Just Cause (1995),Jupiter's Wife (1994)
To Kill a Mockingbird (1962),All About Eve (1950),"Secret of Roan Inish, The (1994)",This Is Spinal Tap (1984),"Crying Game, The (1992)",Hush (1998),Higher Learning (1995),Mr. Jones (1993),Swimming with Sharks (1995),Mother Night (1996)
Sense and Sensibility (1995),Priest (1994),Trial and Error (1997),Ghost (1990),"Joy Luck Club, The (1993)","Garden of Finzi-Contini, The (Giardino dei Finzi-Contini, Il) (1970)","Beans of Egypt, Maine, The (1994)",Ill Gotten Gains (1997),"Underneath, The (1995)",Funny Face (1957)
"Sword in the Stone, The (1963)",Return of the Jedi (1983),"Lost World: Jurassic Park, The (1997)",In the Name of the Father (1993),Dr. Strangelove or: How I Learned to Stop Worrying and Love the Bomb (1963),Audrey Rose (1977),McHale's Navy (1997),Bride of Frankenstein (1935),Cosi (1996),"Designated Mourner, The (1997)"
Citizen Kane (1941),"Postino, Il (1994)",Die Hard (1988),Glory (1989),Little City (1998),Ghost (1990),Giant (1956),Speed 2: Cruise Control (1997),Before Sunrise (1995),Contact (1997)
Love Jones (1997),Money Talks (1997),Metisse (Caf_au Lait) (1993),My Favorite Season (1993),All About Eve (1950),Frankie Starlight (1995),Surviving the Game (1994),"Horseman on the Roof, The (Hussard sur le toit, Le) (1995)",Enchanted April (1991),Marlene Dietrich: Shadow and Light (1996) 
"Fugitive, The (1993)",Faster Pussycat! Kill! Kill! (1965),"Air Up There, The (1994)",Hedd Wyn (1992),Ayn Rand: A Sense of Life (1997),"Game, The (1997)",Ed Wood (1994),Bent (1997),Death in Brunswick (1991),Naked (1993)
Fathers' Day (1997),"Truth About Cats & Dogs, The (1996)",How to Be a Player (1997),Hercules (1997),Contact (1997),"Wrong Trousers, The (1993)","Hour of the Pig, The (1993)","Old Man and the Sea, The (1958)",Braindead (1992),Fargo (1996)
Top Gun (1986),Forrest Gump (1994),Alien: Resurrection (1997),Far From Home: The Adventures of Yellow Dog (1995),Reality Bites (1994),Swimming with Sharks (1995),On Golden Pond (1981),Once Upon a Time in the West (1969),I.Q. (1994),Anna (1996)
Jerry Maguire (1996),Face/Off (1997),Fall (1997),Money Talks (1997),Multiplicity (1996),Richie Rich (1994),Nil By Mouth (1997),North (1994),Celtic Pride (1996),"Portrait of a Lady, The (1996)"
To Kill a Mockingbird (1962),Casablanca (1942),C'est arriv_près de chez vous (1992),Angela (1995),Kids in the Hall: Brain Candy (1996),Winnie the Pooh and the Blustery Day (1968),Marvin's Room (1996),Cop Land (1997),Cyclo (1995),Blood For Dracula (Andy Warhol's Dracula) (1974)
"Last of the Mohicans, The (1992)",Kolya (1996),The Courtyard (1995),Sliding Doors (1998),"Lawnmower Man, The (1992)",Hard Rain (1998),Maya Lin: A Strong Clear Vision (1994),"Air Up There, The (1994)",Mary Reilly (1996),"Great White Hype, The (1996)"
Blade Runner (1982),Wend Kuuni (God's Gift) (1982),"Relic, The (1997)","Big Green, The (1995)",Heavy (1995),Courage Under Fire (1996),Kundun (1997),GoldenEye (1995),Seven Years in Tibet (1997),"Beautician and the Beast, The (1997)"
Tom & Viv (1994),Herbie Rides Again (1974),Wyatt Earp (1994),"Umbrellas of Cherbourg, The (Parapluies de Cherbourg, Les) (1964)",Terminator 2: Judgment Day (1991),"Hudsucker Proxy, The (1994)",Power 98 (1995),"Sweet Hereafter, The (1997)","African Queen, The (1951)","Cure, The (1995)"
G.I. Jane (1997),"Edge, The (1997)","Smile Like Yours, A (1997)",Hercules (1997),"Princess Bride, The (1987)",Father of the Bride (1950),Kolya (1996),Private Benjamin (1980),"Women, The (1939)",Muppet Treasure Island (1996)
Men in Black (1997),"Man of No Importance, A (1994)",Star Wars (1977),Ed Wood (1994),Mary Reilly (1996),Gigi (1958),"Adventures of Robin Hood, The (1938)","Abyss, The (1989)","Bewegte Mann, Der (1994)",Matilda (1996)
"Silence of the Lambs, The (1991)",Clear and Present Danger (1994),Fantasia (1940),Dead Man Walking (1995),Home for the Holidays (1995),"Promesse, La (1996)",Nosferatu a Venezia (1986),Gordy (1995),"Big Green, The (1995)",Hurricane Streets (1998)
Desperate Measures (1998),"African Queen, The (1951)",Amityville II: The Possession (1982),Tomorrow Never Dies (1997),"Mighty, The (1998)",JLG/JLG - autoportrait de décembre (1994),Two Much (1996),This Is Spinal Tap (1984),"Professional, The (1994)",Girl 6 (1996)
Night of the Living Dead (1968),Terminator 2: Judgment Day (1991),"Air Up There, The (1994)",Assassins (1995),Pulp Fiction (1994),Shopping (1994),Enchanted April (1991),Anna Karenina (1997),Being Human (1993),Waiting for Guffman (1996)
